{
    "$schema": "https://phpvms.net/schemas/addon.schema.json",
    "schema_version": 1,
    "name": "Awards",
    "alias": "awards",
    "registry_id": "phpvms/awards",
    "version": "1.0.0",
    "type": "module",
    "description": "",
    "keywords": [],
    "active": 1,
    "order": 0,
    "providers": [
        "Modules\\Awards\\Providers\\AwardServiceProvider"
    ],
    "aliases": {},
    "files": [],
    "requires": [],
    "database": {
        "tables": []
    }
}
