{
    "$schema": "https://phpvms.net/schemas/addon.schema.json",
    "schema_version": 1,
    "name": "SampleVueSlot",
    "alias": "sample-vue-slot",
    "registry_id": "phpvms/sample-vue-slot",
    "version": "1.0.0",
    "type": "module",
    "description": "Reference third-party addon that injects a pre-built Vue (ESM) component into the per-row `bids.row.actions` slot of the skylight My Bids table — the pattern the external ACARS plugin uses.",
    "keywords": ["skylight", "slot", "vue", "example", "acars"],
    "active": 0,
    "order": 0,
    "providers": [
        "Modules\\SampleVueSlot\\Providers\\SampleVueSlotServiceProvider"
    ],
    "aliases": {},
    "files": [],
    "requires": [],
    "database": {
        "tables": []
    }
}
